Type,Text (raw data),,,,,,,,,,,,,,,,,,,,,,,,
Terrorist,"That the human species is an utter plague to the natural order is indisputable. With carefree disregard, we devastate the planet and enslave our nonhuman brethren — the depth and scope of our crimes both unfathomable and incalculable. And every single one of us is stained by the genocide in which we are all complicit. Yes, vegans too. Removing ourselves from the equation of death did nothing to absolve us of our sins; furthermore, we tacitly approve and tolerate a society bathed in blood. I know of no vegan who walks around kicking people in the kneecaps when they graze in the frozen cemeteries at supermarkets. While I’ve done it on occasion, we don’t generally walk around cutting the lines of those who fish — cowards who jam hooks through the faces of unsuspecting animals for fun. We’re still complicit.

Enter SARS-CV-2. The governments of the world are not at all concerned if the masses are thinned, so the hysteria around this virus and the draconian, militaristic social controls being implemented are far more troublesome than the pandemic. I propose everyone resume normal life, go out there and catch our coronavirus, build our immunities or drop dead. Let our infrastructure get overwhelmed, let our artificial and unsustainable social constructs collapse, and, as a close friend observed, maybe revert to an agrarian society. I couldn’t care less where any human falls on this issue, but I challenge anyone to argue that a swift kick in our privilege — a leveling out of the almighty human species — is not a positive development for the animal kingdom we’ve eviscerated.

Every health “crisis” in recent memory has resulted from a contagion jumping species — mad cow, bird flu, swine flu, ebola, sars, covid (or sars2) — purely by virtue of humans believing we’re entitled to to satiate our deviate penchants at their expense. We’ve earned karmic justice, whether or not this one turns out to be anything close. And as far as our nonhuman victims are concerned, Covid is not nearly deadly enough. I don’t expect our arrogance and hubris to recede after this year’s pandemic subsides, so let’s take bets on from where our next gut punch to our human privilege will come. Cow’s milk? Sealife? Unfertilized chicken eggs? I won’t cry when the inevitable next one hits either.

I have, however, been increasingly disturbed by contingents of the vegan community embracing (wittingly or not) vivisectors and their vaccine industry. All hail vivisectors!? We’re now praying to the psychopathic gods of animal torture for our salvation? If we need a vivisector to harm a single animal to save a single one of us, then it’s all over. We as a community that alleges to advocate for animals has truly lost its way.

It’s probably been a long time coming. I’ve pretty much watched in disgust as the business models of welfarism and street theater have replaced activism. We’ve all seen the celebrated groups who see every suffering animal as an opportunity to collect donations. The groups whose marketing acumen has successfully equated staged profit-motivated law skirting with civil disobedience and gained a fawning following in the process. Those who wait for industrial abusers to extract their profits on their victims’ suffering and then swoop in to extract every last penny from their blood — either with self-enriching welfare violation “blockbusters,” donation solicitations for Queenie (a dog tortured to death in a Detroit lab almost a decade ago, her “advocates” protecting her tormentors from alleged radicals because those precise vivisectors are a necessity for them to continue to pad their bottom line), or staged open rescues. If we still need welfare investigations to figure out that animals suffer in labs and other cages, then we’re essentially useless. If we can mobilize hundreds of well-meaning but misguided activists to do photo ops with with a rescued victim but fail to throw our bodies on the machine to shut it down, then Animal Liberation is not the objective. The profit-motivated photo op is. How is this not obvious? What is glaring & painful to me is that we have way too many demagogues, frauds, and self-serving charlatans contaminating activism and leaving the animals on their own.

I opened this essay by discussing our complicity, but I’d never argue that smacking a burger out of someone’s mouth is effective action in the pursuit of our goal. I’d be doing it myself if I thought it would benefit the enslaved animal nations. Our ONLY job when it comes to animals & their abusers is to help the former and make the latter fear for their lives. A wholesale slaughter of vivisectors makes perfect strategic sense. Anyone who torments their restrained victims is nothing more than a coward who has a bright red target on his or her back. Start picking a few off and the rest will run for cover, hiding behind children and old ladies. They’re subhuman scum who’ve relinquished any right to consideration or comfort. So alleged activists waiting for these same cretins to poison and slaughter countless nonhumans in pursuit of a vaccine is something around which I cannot wrap my mind. I remember Walter Bond telling me probably a decade ago that “we can’t rally the troops because we have no troops.” But have we simply dropped all pretenses in the midst of our “crisis” of human privilege and just switched sides? It’s an absolute embarrassing disgrace.

While some are comfortable with the 100-year plan, either to turn the world vegan or form alliances with other militant and radical social justice movements (we may have a few isolated militant or radical actors, but no one is ever going to mistake our “movement” for either), I posit that the animals don’t have the luxury to wait for us to outgrow speciesism and self-interest. Time, like academic musings or theoretical minutia, are functions of our human privilege that are foreign to those in desperate need of relief now. This second. We must grasp that our only job is to stop every single abuser we can and, in the process, save countless more victims than we could ever liberate otherwise.

If we’re too busy to organize focused local efforts designed to undermine exploiters and compromise their infrastructure, then the animals will continue to die. Symbolic actions, candles, and photo ops might be profitable, but they stop no one. Those of us who haven’t been contaminated by mainstream welfarism and social media recipe cliques need to embrace our own radical ideas and trace a new trajectory for those who will follow. Arbitrary acts carried out by sequential individuals can have a significant impact– knock on a vivisector’s door and cough in their face before covid disappears, we haven’t had a good car bombing in a while, send their kids a present in the mail while they’re all being home schooled, they all have neighbors who’d appreciate a nice mass mailing. Or simply do what we know is just — a life for a life. The second one of these miscreants or their spawn comes to harm is the second we become an actual threat. (Edit: May 20 – Since I wrote this almost two months ago, we’ve seen armed militias and right-wing actors showing up at govt buildings in aggressive protests. I’ve wondered when we’ll see Animal Liberation activists follow suit and start showing up at the homes of vivisectors and other deserving abusers with our own weapons. Then I remembered, most of my colleagues are too busy hiding under a table waiting for the gods of vivisection to torture enough animals to death to make their world safe. My disillusion is palpable.)

And since we’ve failed miserably, let’s thank the pandemics for stepping in and maybe doing that of which we appear incapable for now — thinning out the most dangerous & malignant predator species to walk the face of the earth. Unfortunately, initial antibody testing indicates covid’s only got around a .1 to .3% mortality rate, comparable to the seasonal flu. But I have faith in the next pandemic my species continues to court. And I look forward to you all walking around in your designer hazmat suits next time around. I’m sure those selfies will replace the cutsie mask ones eventually.",,,,,,,,,,,,,,,,,,,,,,,,
Terrorist,"As of this writing, almost 2 million humans have been infected in the Covid-19 Coronavirus pandemic, and well over 100,000 have died as a result. Even so, although the true numbers are unknown, only a fraction of a percent of all humans have been sickened, and less than 6% of those infected have died. The majority of the 7.7 billion humans wrecking havoc on our planet and torturing and murdering hundreds of billions of non-human animals annually are continuing to go about their evil business as usual. If one believes, as we do, that humans are the real virus infecting planet earth, we can only bemoan the fact that so many humans will likely remain viable throughout the current pandemic.

The source of the current pandemic of Covid-19 is believed to be a “wet market” in Wuhan, China. In a wet market, all kinds of animals, live and dead, are for sale for consumption, many of them still alive in cages, many killed on the spot. The virus is believed to have originated in bats before moving to an intermediary animal widely consumed by humans after sale in these markets.

These markets contain fish packed into shallow tubs that splash water all over the floor. The floors and counter tops of stalls are slick and red with the blood of animals killed, skinned and gutted as customers watch. Live turtles and crustaceans climb over each other in desperate bids to escape filthy plastic boxes. Birds and mammals scream as they are killed; sick and wounded animals crammed into small cages stacked high drip blood, pus, feces, and urine onto other animals in cages below. In the eyes of all of them there is misery and terror. Water, blood, fish scales and animal guts are everywhere. Melting ice adds to the slush on the floor.

For years, scientists have warned that filthy markets crammed full of sick animals are breeding grounds for new, antibiotic-resistant “superbugs.” Some studies claim that by 2050, more people will be dying from these infectious diseases than from cancer. What the world is witnessing in horror in 2020 will someday be common. The United Nations has found that 70% of new human diseases, such as HIV(chimpanzees), Mad Cow Disease, Avian Flu(birds), Ebola(bats) and Swine Flu(pigs) were directly linked to animals used for food.

Amid the Coronavirus pandemic, we continue to be stunned by the lack of serious reporting on the source of the problem. Finally, after weeks of sparse coverage, we are beginning to see the issue come to light through figures that have captured the world’s attention, like Dr. Anthony Fauci, Director of the National Institute of Allergy and Infectious Diseases, who stated that “It boggles my mind how when we have so many diseases that emanate out of that unusual human-animal interface [wet markets], that we don’t just shut it down. I don’t know what else has to happen to get us to appreciate that.”

The writing has been on the wall for years. Animal agriculture, in all of its manifestations — from the disembowelment of pigs, slaughter of cows, killing of chickens on assembly lines, to the bloodthirsty “sport” of hunting — is a ticking time bomb. And its not only, or even primarily, infectious agents that are doing the killing. Heart disease and stroke, also the direct result of a flesh-based diet, kill 18 million people worldwide each and every year. We humans have a “vaccine” (a plant-based diet) for this major killer and yet knowingly fail to utilize it.

Unless humans change the way they live with animals, no amount of soap and hand sanitizer, social distancing or ventilators is going to save them as a species. Maybe that’s a good thing.",,,,,,,,,,,,,,,,,,,,,,,,
Terrorist,"Greta Thunberg, a young environmental activist, has become a powerful icon in our popular culture. Time magazine named her the 2019 “person of the year.” Many governments and business leaders, including Trump, have lashed out at her activism, and even her personally.

Concern regarding climate change and other environmental issues is clearly growing, particularly in North America. Part of this interest can be reflected in the current movement toward veganism, based on both environmental concerns and an embrace of “animal liberation” in general. Others have adopted an entirely plant-based (vegan) diet for reasons of weight loss and personal health and well-being goals.

How should Marxists respond to the arguments in favor of animal liberation? What position should we take on the growing thought that animals should not be used for agricultural purposes?  Is there a way for us to address this movement in a serious way? A failure to address animal liberation could lead to the perception that Marxists don’t really care about environmental issues, and perhaps to an extent that perception is correct!

It should be noted at the outset that veganism in itself is politically neutral. In their book Vegan Freak: Being Vegan in a Non-Vegan World (2010), Bob and Jenna Torres point out that veganism has representation from every political system of belief on the planet. We can note that Adolf Hitler was a vegan! His veganism was based on a Nazi concept of the purification of the body. We certainly should not dismiss the movement based on his conception of purity! What makes veganism a concept worth exploring is precisely the way that the movement addresses core political issues such as class, exploitation, and alienation.

To begin, we should note that some communists have written off the vegan approach as being liberal or bourgeois in its origins. That is a reasonable response to the narratives currently employed by People for the Ethical Treatment of Animals (PETA). That organization is the most vocal vegan organization in the West. Many may appreciate their videos or online posts about the importance of stopping animal cruelty. Marxists can certainly agree that measures could reasonably be taken to stop needless suffering.

For most of us, however, that’s where the agreement stops. PETA has acted in ways that have, rightly, been condemned as “environmental racism.” Activists such as Pamela Anderson have famously fought against the seal hunt. Attacks on the seal hunt can lead to a racist and imperialist approach which attacks the traditional practices of Indigenous peoples around the world, particularly those based on hunter-gatherer economies. It is very hard to imagine that those living in far-north Arctic regions will be able to find their protein source from plants. Eating seal and caribou are essential to the provision of protein in their diet.

Approaches based on PETA have also focused on personal responsibility and the practice of “ethical consumption.” It has long been held that individual consumers should personally adopt a vegan lifestyle in order to personally stop the exploitation of animals by the agricultural sector. Within a capitalist framework, just how are our personal eating habits going to change capitalist industry?

We also need to explore the fact that when a product has been labelled “vegan” it can literally be sold at triple the price. Most working-class and poor families cannot afford to have their grocery bill tripled. As a result, many workers have ruled out living a vegan lifestyle. To take the argument seriously, however, we need to acknowledge that it doesn’t have to be this way. The vegan diet is typically made of fruits, vegetables, grains and legumes. There is absolutely no reason for such food items to be more expensive than meat, dairy, eggs or honey. Corporations have co-opted veganism by making “vegan” products so expensive. We need to challenge that!

We should also pay attention to the fact that, in India in particular, Hindu nationalism has been used to oppress Muslim people. Many Hindus and Buddhists around the world have embraced vegetarianism, and even veganism. What is concerning is the attack on those minority religious communities which traditionally have included meat consumption in their diet. Many vegans have criticized the practice of halal (or Muslim) meat production in which an animal’s throat is slit, similar to Jewish kosher meat production, calling it cruel. Arguments based on Islamophobic or anti-Semitic claims absolutely need to be rejected by anti-imperialist Marxists around the world.

Vegan Marxism?

Having explored the rejection of a liberal bourgeois argument, is it possible to adopt a vegan Marxist approach? Let’s take a look at a couple of issues which could form the basis for just such a position and practice.

Vegan Marxism needs to take, as its starting point, a solidarity with all workers who are currently employed in the field of animal agriculture. In North America, meat is extremely popular as a source of protein, and as a culinary enjoyment. Many of us retain fond memories of a family day in the summer around a barbecue! At the same time, most of us don’t really want to think about the fact that our meat that we love so much came from a sentient, caring and loving animal. As a result, those workers who are employed in slaughterhouses, meat packing plants, and butchery operations are typically workers at the very bottom of the ladder. In the U.S. in particular, it has been determined that workers in this field are over-represented by undocumented Mexican immigrants.

Several films on the Netflix platform such as Cowspiracy address this phenomenon. Major agricultural firms will employ such workers due to the fact that they can get away with paying these workers poorly. Vegan Marxists must take the material interests of such workers to heart.

Marxists who follow a vegan approach, and ecologists in general, often point out that animal-based agriculture is simply not sustainable. The amount of resources needed to produce a pound of meat, for instance, includes the feeding and grazing of cattle at a level of immense proportions. Animal-based agriculture is currently the largest industrial contributor to environmental destruction.

Take, for example, the deliberate burning of Amazon rainforests in Brazil to make way for cattle ranching. Beef and dairy production requires a massive amount of water and resources such as corn and soybeans, which could be used to feed people directly. Each year, the amount of cattle on the Earth increases far beyond the level that would occur by nature. Cattle used for dairy, for instance, are artificially inseminated so that they will become pregnant and give birth to calves. This is done in order for cattle to be able to lactate, and thereby produce milk. Those vegetarians who consume dairy, eggs, and honey are often quite saddened to learn that the calves produced in this way are typically diverted to veal production. Again, beef and dairy production demands more available land, which, under a capitalist framework, means the destruction of forests (the lungs of the Earth) and the loss of land previously held by Indigenous peoples around the world.

Vegan Marxists also really need to look at the fact that most people living largely on a plant-based diet do so on an involuntary basis. For most citizens of the world, meat is a luxury. For the environmental movement to be successful, all peoples of Earth must not only be considered as equals, but be treated as equals. In North America and Europe, meat and dairy production is heavily subsidized. Those subsidies reflect a decision, made socially, to value such production. It is very difficult to imagine that animal liberation or the ceasing of environmental degradation can be achieved under a capitalist framework. Under socialism, and ultimately, communism, social resources can be harnessed which are based on a more sustainable model of development.

It certainly is possible for Marxists to seriously address the environmental movement. A failure to do so could be dangerous, both for the socialist movement but also for our planet. It is also possible, and arguably necessary, for the environmental movement to seriously embrace an anti-racist, anti-capitalist, and anti-imperialist framework!",,,,,,,,,,,,,,,,,,,,,,,,
Terrorist,"From its editorial:  “a magazine for the radical anarchist, the animal liberationist and those who are willing to fight for a better world.”

Wildfire Magazine is a new animal liberation and anarchist magazine that covers direct action news, philosophy and theory and poractical adive and skills alongside a clean and neat design.

NOTE: Although Unoffensive Animal stocks Wildfire Magazine, we are not responsible for its editorial, or the contents within it. We do not endorse, condone or promote any form of illegal activities.
",,,,,,,,,,,,,,,,,,,,,,,,
Terrorist,"As you know, one of the main tasks we do is to serve as an anonymous platform for folks who decide to take action but want to remain anonymous. Be it the liberation of animals from a p[lace of exploitation to the sabotage of infrastructure or tools used to abuse animals and the earth, Unoffensive receives reports from around the globe to be published anonymously.

With it, there is the question of how to send those reports securely. Whilst in reality, any form of internet communications is never 100% secure, folks can take steps so they are safer online in order to ensure they can keep working without the burden of prosecution by the law. In this post we want to briefly cover the ins and outs of report sending.

Let us start with the most basic of all. You should NOT send reports online over instagram or Facebook private message. It is not private and it is in fact very easy to track down. This might come as a surprise to many, but we have received reports over social media before, and we suspect it to still be a thing in the future. We do not want to know who you are, and if you do not want folks to know who took action, you should not be using insecure platforms. If, on the other hand, you want to publicise an open rescue, that is for you to choose, but we rarely platform that kind of action as it already carries traction in other social media groups.

So how do you actually send a report? We have an exhaustive explanation on our website under the “Contact Us” tab, but we can quickly explain over here. There are two main methods that you can chose from, one being the form within our website and the other one, using a spam email address. Regardless, both of them require a couple of steps before you do any sending.

The first step would be to connect to a VPN. VPN serves as a mask between your computer and the Internet Service Provider. Instead of you asking the questions to the Internet provider, you tell the VPN to ask those questions for you. You NEED to understand that using solely a VPN does not equate to being secure, anonymous or private online. In this case, we only need the VPN to not let your internet service know you are connected to a TOR network (we will explain this shortly!). You can download and use very intuitively RiseUp VPN or ProtonVPN.

Once you are connected to a VPN, you want to open TOR. TOR is like any other internet browser, but it uses multiple jumps (or nodes) to go from the request to the answer. For that reason, it is a lot more difficult to track down your internet activity. It also comes packed with tools that help with privacy and don’t let websites spy on your behaviour. You can download and install TOR (for free!!) in torproject.org

Once you have connected to a VPN and opened TOR, you have two choices. One is to simply fill the form in our contact us and click send. We have it configured so that it is encrypted and only us holding the private key are able to understand the language of the email.

If you do not want to fill up that form, you can instead use a spam email address (never your personal address!) to send a report. You can go to any spam email service like tempr.email, which creates a disposable address without any details where you can compose an email and send it to unoffensiveanimal(at)riseup(dot)net.

If you need to send media (photos or video) you should be aware of metadata. You can read more about it on our website. Once you got rid of metadata, you can simply attach it (whilst still using TOR and a VPN) to any file sharing service (like WeTransfer, also free) and then paste the link to download the files in the same email as the report.

The report should not include any personal details or anything that can give away your identity. We don’t need to know, and we (almost always) simply copy and paste the report without any editing. Be mindful about what you are writing.

It is as simple as that! You can read more about it on our website www.unoffensiveanimal.is/contact-us

Stay Safe.

LOVE AND RAGE.",,,,,,,,,,,,,,,,,,,,,,,,
